id,Product/Barcode,Product Name,Price
__export__.product_product_17093_df40dc0e,039079091510,Adams  Flea & Tick Cat Shampoo12OZ,11.71
__export__.product_product_17094_c136e661,039079012287,Adams Carpet Powder 16 oz,12.09
__export__.product_product_52583_bec4e869,039079058957,Adams Flea & Tick Spray,22.55
__export__.product_product_17100_e7ee4eb4,039079090025,Adams Flea & Tick Shampoo With PRECOR 120,11.71
__export__.product_product_17105_080a0a8f,039079058940,Adams Spray Flea and Tick Spray - For Cats 473ml,12.58
__export__.product_product_52601_4d040931,847922082031,All For Paws Chill Out Cooler Bowl,6.29
__export__.product_product_52600_a4adf6f5,847922082024,All For Paws Chill Out Cooler Bowl,5.30
__export__.product_product_52602_65670659,847922082185,All For Paws Chill Out Cooler Bowl,12.20
__export__.product_product_17519_325c3490,847922081867,All For Paws Chill Out - Garden Fountain (with compression release function),14.05
__export__.product_product_17182_e7d5d140,123456700281,All For Paws Chill Out - Water Fountain (Connector),11.46
__export__.product_product_17264_2eeea7dc,847922031961,All For Paws Interactive - Hyper Fetch Mini,46.08
__export__.product_product_17266_0aa7b10a,847922032074,All For Paws Interactive - Lucky Treat,30.14
__export__.product_product_17268_a7c5b51d,847922031954,All For Paws Interactive - New Hyper Fetch 2.5 inch Ball,81.81
__export__.product_product_17269_6c87e456,847922032081,All For Paws Interactive - Silicon pad,7.77
__export__.product_product_17270_67737905,847922032005,All For Paws Interactive-Food Maze,7.89
__export__.product_product_17338_940ad3c7,847922043063,All For Paws Mighty Rex - Mighty Flyer,7.16
__export__.product_product_52611_6d044223,847922081379,All For Paws New Travel Dog Harness,9.61
__export__.product_product_52610_7aa42a5c,847922081362,All For Paws New Travel Dog Harness,8.14
__export__.product_product_52609_6bc992cf,847922081355,All For Paws New Travel Dog Harness,7.52
__export__.product_product_52612_850cb71b,847922081386,All For Paws New Travel Dog Harness,10.24
__export__.product_product_52614_6ee2b455,847922080693,All For Paws Outdoor All Road Boots,20.83
__export__.product_product_17479_5750cfff,847922025516,All For Paws Vintage Cat - 3 Post vintage,100.91
__export__.product_product_17482_781957bb,847922025523,All For Paws Vintage Cat - 3 Level Furniture,135.89
__export__.product_product_52613_5fc2653f,847922080686,All For Paws Outdoor All Road Boots,19.47
__export__.product_product_52616_8203b98b,847922080716,All For Paws Outdoor All Road Boots,21.95
__export__.product_product_43640_c40f4f36,317163040874,API Algaefix Aquarium Cleaner 237ml,6.05
__export__.product_product_43639_d5f153d2,017163003526,API Tap Water Conditioner For Aquarium Water 473ml,7.28
__export__.product_product_53686_de3fb003,810281012513,Aquatop Internal Sponge Filter,5.04
__export__.product_product_53687_998a44f0,810281012520,Aquatop Internal Sponge Filter,5.49
__export__.product_product_53688_9ec36a26,810281012537,Aquatop Internal Sponge Filter,6.16
__export__.product_product_56650_b1e3d7ee,8683229861281,Baffs Naturals Beef Sinew 100+g,1.90
__export__.product_product_56654_a6129ffc,8683229861489,Baffs Naturals Beef Strips 100g,2.70
__export__.product_product_56651_6179b62c,8683229861298,Baffs Naturals Beef Tendon 100g,4.50
__export__.product_product_56653_75bdc066,8683229861304,Baffs Naturals Beef Trachea 100+g,1.90
__export__.product_product_56661_b7627046,8683229861328,Baffs Naturals Beef Trachea Snacks 100+g,2.70
__export__.product_product_56649_62f4a120,8680000000037,Baffs Naturals Bully Sticks 100+g,6.90
__export__.product_product_56659_70f37e58,8683229861434,Baffs Naturals Chicken Feet 100g,2.70
__export__.product_product_56660_6c29903e,8683229861427,Baffs Naturals Chicken Neck 100g,2.70
__export__.product_product_56652_7550056d,8683229861335,Baffs Naturals Beef Lung Cubes 100+g,1.40
__export__.product_product_56656_2b32e28d,8683229861229,Baffs Naturals Lamb Lung Training Bits 100g,2.70
__export__.product_product_56658_1c6bc3f9,8690627023555,Baffs Naturals Lamb Mini Burger 100+g,2.70
__export__.product_product_56655_309f0b43,8683229861458,Baffs Naturals Lamb Pizzle 100+g,3.40
__export__.product_product_56657_10d0e492,8683229861311,Baffs Naturals Lamb Trachea 100+g,2.70
__export__.product_product_50843_dc6351f0,8711231182701,Beaphar Macadamia Oil Shampoo For Puppy 250ml,5.41
__export__.product_product_50841_45d8a38e,8711231182589,Beaphar Aloe Vera White Coats Shampoo 250ml For Dogs,5.41
__export__.product_product_50845_c95d0bbf,8711231182947,Beaphar Fruit Aroma Anti Tangle Shampoo for Dog 250ml,5.41
__export__.product_product_50846_d7f50893,8711231173235,Beaphar Tooth Gel100g,5.86
__export__.product_product_21227_37f5899d,034202223394,Bird Brainers TOY ALPHA BLK/DOWEL/BEADS 10IN,7.16
__export__.product_product_43475_268d342a,034202221635,Bird Brainers TOY WD BLK/SPOOL/BELL 8IN,3.07
__export__.product_product_17654_7927141d,021653402164,Bio-Groom Coat Polish Spray 473 ml,10.24
__export__.product_product_17665_54e22cad,021653260085,Bio-Groom Kuddly Kitty Shampoo 236 ml,8.02
__export__.product_product_17669_47215fd0,021653330122,Bio-Groom Natural Oatmeal Cream Rinse 35,8.38
__export__.product_product_17672_021f7484,021653540040,"Bio-Groom Natural Scents Dog Cologne, Crisp Apple, 4-Ounce",7.65
__export__.product_product_17679_46d43eee,021653320321,Bio-Groom Silk Conditioning Cream Rense 32 oz,11.22
__export__.product_product_17682_e67156fb,021653216129,Bio-Groom Ultra Black Shampoo 12oz,7.03
__export__.product_product_52519_53933431,6970117122220,Bioline Aloe Vera Conditioner for Dogs 250ml,2.95
__export__.product_product_17685_ce87e87c,6970117120837,Bioline Aloe Vera Shampoo 1L,6.78
__export__.product_product_17686_e6a68594,6970117121278,Bioline Aloe Vera Shampoo 5L,19.72
__export__.product_product_17688_be1c74cf,6970117122008,Bioline Anti Parasit Coat Spray 207ml,7.27
__export__.product_product_52538_68502676,6970117123845,Bioline Deodorant Freshing Spray with Baby Powder For Cats & Dogs,3.80
__export__.product_product_17726_83bbcb02,6970117120004,Bioline High Absorbent Towel 66x43cm,6.78
__export__.product_product_52540_6d392d0a,6970117120240,Bioline Cage Cleaning Spray for Small Animals & Birds 500ML,4.50
__export__.product_product_52523_f4e3d551,6970117124095,Bioline Calming Shampoo for Cats & Dogs 250ml,2.95
__export__.product_product_17692_ec91aaf2,6970117120318,Bioline Cat Grass Kit 12g,3.10
__export__.product_product_17693_cf47914d,6970117120820,Bioline Cat Shampoo 1L,6.78
__export__.product_product_17694_c3ba9b11,6970117120059,Bioline Cat Shampoo Especially For Mild Care 250ml,2.95
__export__.product_product_52561_08978b45,6970117124507,Bioline Chicken & Scallop Kitten Liquid Snacks 4x15gm,1.10
__export__.product_product_17766_02471c7e,6970117121964,Bioline Safe and Non Toxic Catnip Bubbles 120ml,3.10
__export__.product_product_17702_5e623865,6970117122930,Bioline Deinsectization Shampoo for Pets 200ml,5.93
__export__.product_product_17703_b616d8e6,6970117120431,Bioline Dental Care Set Beef Flavor 100g,3.59
__export__.product_product_17706_ea558742,6970117122589,Bioline Dental Hygiene Gel Beef Flavor 100g,3.59
__export__.product_product_17707_d3a1de34,6970117123623,Bioline Dental Hygiene Set For Cats 50g,4.33
__export__.product_product_17753_09491d7d,6970117121407,Bioline Perfume Chance 207ml,5.44
__export__.product_product_17755_7ad690b3,6970117121391,Bioline Perfume Love Letter 207ml,5.44
__export__.product_product_17754_4c79f234,6970117121384,Bioline Perfume Cologne 207ml,5.44
__export__.product_product_17711_16e98496,6970117120134,Bioline Deodorizing Spray For Cat 175ml,4.33
__export__.product_product_17712_3a26279e,6970117120127,Bioline Deodorizing Spray For Dog 175ml,4.33
__export__.product_product_52543_c275fdd5,6970117123821,Bioline Deodorizing Spray for Small Animals 175ml,4.90
__export__.product_product_52537_d33a8d33,6970117120462,Bioline Deodorizing Spray Pets 500ML,6.50
__export__.product_product_52527_a3e97d5f,6970117123890,Bioline Deshedding Shampoo for Cats 200ml,2.95
__export__.product_product_52521_ac6d3aea,6970117123920,Bioline Deshedding Shampoo for Dogs 200ml,2.95
__export__.product_product_17713_4c0dda03,6970117120202,Bioline Dry Clean Powder 100g,2.85
__export__.product_product_17718_4b3e6af2,6970117120141,Bioline Eye care drop 50ml,3.10
__export__.product_product_52549_12f4f76a,6970117120455,Bioline Flea & Tick Spray for Dogs 175ml,4.20
__export__.product_product_52548_a9b25c4e,6970117124422,Bioline Flea & Tick Spray for Cats 175ml,4.20
__export__.product_product_17723_88352f0b,6970117120219,Bioline Foam shampoo 220g,4.33
__export__.product_product_17715_bffcea44,6970117121896,Bioline Ear Powder For Dogs 30g,5.55
__export__.product_product_17696_695e558b,6970117120295,Bioline Catnip Dental Sticks 10g,1.85
__export__.product_product_52522_36952c18,6970117124248,Bioline Glossy Coat Shampoo for Cat & Dog 250ml,2.95
__export__.product_product_52552_f1e3a5bf,6970117122404,Bioline Calcium Tablet with Goat Milk for Cats & Dogs 160 Tablets,1.80
__export__.product_product_17725_b2f133bc,6970117120196,Bioline Hairball Solution For Cats 100g,5.41
__export__.product_product_17727_91a68a4d,6970117122299,Bioline High Energy Activated Probiotics 25g,5.93
__export__.product_product_17729_364a86be,6970117120233,Bioline Keep off Jelly 225g,4.33
__export__.product_product_17731_45b411e1,6970117120288,Bioline Keep off Spray for Dog 300ml,4.44
__export__.product_product_52528_2da04640,6970117123852,Bioline Kitten Shampoo for Shiny Fur 200ml,2.95
__export__.product_product_17733_dce5ef64,6970117122886,Bioline Long Hair Shampoo Especially for Mild Care 250ml,2.95
__export__.product_product_17736_d88ec199,6970117120844,Bioline Mink Oil Shampoo 1L,6.78
__export__.product_product_17737_754e301a,6970117120608,Bioline Mink Oil Shampoo 5L,19.72
__export__.product_product_52516_973c2a9e,6970117120073,Bioline Mink Oil Shampoo for Cats & Dogs 250ml,2.95
__export__.product_product_52525_cb4efc4c,6970117123876,Bioline Multi Coloured Hair Shampoo for Cats 200ml,2.95
__export__.product_product_52517_e88529dd,6970117120080,Bioline Natural-Oil Conditioner for Dogs 250ml,2.95
__export__.product_product_54695_1f975ddf,6970117122237,Bioline Natural-Oil Conditioner,19.72
__export__.product_product_52530_970055d6,6970117123357,Bioline Natural Pet Nose Balm 20ml,4.60
__export__.product_product_54694_8451c8db,6970117120851,Bioline Natural-Oil Conditioner,6.78
__export__.product_product_55535_07c3922e,6970117120868,Bioline Neem Tree Oil Shampoo,6.78
__export__.product_product_17746_cd72072a,6970117121285,Bioline Neem Tree Oil Shampoo 5L,19.72
__export__.product_product_55534_315e3341,6970117120097,Bioline Neem Tree Oil Shampoo,2.95
__export__.product_product_52515_d6770eb5,6970117120066,Bioline Natural Shampoo for Cat & Dogs 250ml,2.95
__export__.product_product_17748_8a6d5c14,6970117121933,Bioline Nutrition Cream For Dog 100G,5.41
__export__.product_product_17750_68f39c09,6970117120172,Bioline Paw Care Cream 50ml,4.19
__export__.product_product_17752_02a484f2,6970117120479,Bioline Paw Cleaning Foam for Dog 150ml,3.45
__export__.product_product_17751_f04f4f3a,6970117121308,Bioline Paw Cleaning Foam For Cat 100ml,3.45
__export__.product_product_52539_0fa9ca8e,6970117123999,Bioline Deodorant Freshing Spray with Peach Blossom For Cats & Dogs,3.80
__export__.product_product_17739_736cc6de,6970117121766,Bioline Pets Styptic Powder 14g,5.55
__export__.product_product_55537_3e76bf86,6970117120042,Bioline Puppy Shampoo for Mild Care,2.95
__export__.product_product_55538_c19372a4,6970117120813,Bioline Puppy Shampoo for Mild Care,6.78
__export__.product_product_17765_60f359af,6970117122329,Bioline Rinse Fresh Shampoo 3.8ltr,22.19
__export__.product_product_52542_27271a2a,6970117123814,Bioline Stain Remover for Small Animals 118ml,3.80
__export__.product_product_52520_9b9b6a33,6970117123913,Bioline Tea Tree Oil Shampoo for Dogs 250ml,2.95
__export__.product_product_17768_d477a23d,6970117120165,Bioline Tear Stain Remover 50ml,3.10
__export__.product_product_17756_723de4f0,6970117120448,Bioline Pet Dental Spray 175ml,3.34
__export__.product_product_52535_0966936c,6970117122350,Bioline Toothbrush Set for Cats & Small Dogs,2.50
__export__.product_product_17719_3944faec,6970117120561,Bioline Finger Brush Set 2Pcs,2.35
__export__.product_product_17769_3d5f1d27,6970117120301,Bioline Toothbrush Set 4pcs,3.10
__export__.product_product_52531_a4e6d153,6970117124408,Bioline Toothpaste Chicken Flavor 100g,2.35
__export__.product_product_17770_1aab5fa2,6970117120189,Bioline Toothpaste Beef Flavor 100g,2.35
__export__.product_product_52534_00abd79a,6970117124194,Bioline Toothpaste with Liquid Calcium for Dogs & Cats 50GM,2.90
__export__.product_product_17758_14629442,6970117121377,Bioline Pet Wipes 10pcs,1.11
__export__.product_product_52565_a417297a,6970117124033,Bioline Urinary System Health Indicator Cat Litter 6ltr,5.40
__export__.product_product_52529_a58eb14c,6970117123869,Bioline White Coat Shampoo For Cat 200ml,2.95
__export__.product_product_39075_0f3e4103,9780201379624,Pets.Love.Earth Waste Bags Refill Fresh Scent 8 Pcs/Pack,7.23
__export__.product_product_18041_2de7485d,4018761160303,Bunny Nature Bedding Active 35ltr,14.79
__export__.product_product_18045_e48c7a5b,4018761160808,Bunny Nature Bedding Easy- Pink,24.53
__export__.product_product_18046_9eec6365,4018761160815,Bunny Nature Bedding Easy- Turquoise,24.53
__export__.product_product_52880_9de3c032,4018761259236,Bunny Nature Dwarf Hamster Dream Basic,5.04
__export__.product_product_52882_b4b3d524,4018761253234,Bunny Nature Guinea Pig Dream Basic,5.77
__export__.product_product_52883_47ab5117,4018761253258,Bunny Nature Guinea Pig Dream Basic,7.77
__export__.product_product_18059_2cd7e9ac,4018761253050,Bunny Nature Guinea Pig Dream Young 1.5kg,7.77
__export__.product_product_18063_f6b2c94f,4018761142248,Bunny Nature Hay From Nature Conversaton Meadows with Dandelion 250g,2.95
__export__.product_product_43369_fd9841b9,4018761170128,Bunny Nature Interactive Back to the Root 140-200g for Rabbits,9.41
__export__.product_product_18068_befef183,4018761170111,Bunny Nature Interactive Back to the Root XS Gnawing root -60-130g for Rabbits,6.36
__export__.product_product_18069_23ff320f,4018761170180,Bunny Nature Interactive Digging Box,27.12
__export__.product_product_18070_f5aa4516,4018761170197,Bunny Nature Interactive Digging Fun-Sand Mix,9.12
__export__.product_product_50215_26cbf3e0,4018761177011,Bunny Labyrinth LARGE 110X26X57.5CM,67.50
__export__.product_product_56631_58788051,4018761142576,Bunny My Favorite Hay Pumkin For Dwarf Rabbits and Rodents 100g,1.60
__export__.product_product_52889_7c9abbb7,4018761250233,Bunny Nature Rabbit Dream Basic,5.83
__export__.product_product_52892_f71cf95e,4018761250035,Bunny Nature Rabbit Dream Young,5.77
__export__.product_product_56626_3b8095db,4018761209248,Bunny Nature Hamster Dream Expert Hair & Skin 500gr,7.40
__export__.product_product_56629_6b2e054d,4018761142514,Bunny My Favorite Pure Hay For Dwarf Rabbits and Rodents 100g,1.60
__export__.product_product_56630_229378fa,4018761142538,Bunny My Favorite Hay Strawberry & Peppermint For Dwarf Rabbits and Rodents 100g,1.60
__export__.product_product_56633_916a3f96,4018761142521,Bunny My Favorite Organic Sea Buckthorn For Dwarf Rabbits and Rodents 100g,1.60
__export__.product_product_18077_bf8edc40,4018761117024,Bunny Nature My little Sweetheart Red Berries 30g,1.77
__export__.product_product_50220_60efbe4e,4018761177363,Bunny Napptime Bed for Dwarf Rabbits and Rodents 30.7X21.5X51.8CM,17.50
__export__.product_product_18048_5d62013e,4018761120307,Bunny Nature Care Gel 100ml,8.52
__export__.product_product_52890_e517d629,4018761250257,Bunny Nature Rabbit Dream Basic,7.77
__export__.product_product_18081_e1f69006,4018761254330,Bunny Nature Shuttle Guinea Pig-600g,3.42
__export__.product_product_18082_3063c576,4018761251339,Bunny Nature Shuttle Rabbit-600g,3.42
__export__.product_product_56632_2b63821d,4018761144105,Bunny Nature Timothy Hay 125g,1.60
__export__.product_product_56625_b016fc31,4018761255702,Bunny Nature Twin Pack Nature Shuttle Guinea Pig-600g & Guinea Pig Dream Basic 750g,5.50
__export__.product_product_56624_e732de80,4018761252701,Bunny Nature Twin Pack Nature Shuttle Rabbit-600g & Rabbit Dream Basic 750g,5.50
__export__.product_product_52893_6125fadc,4018761250059,Bunny Nature Rabbit Dream Young,7.77
__export__.product_product_50218_ea3d57b5,4018761177301,Bunny Nature Snuffleboard For Dwarf Rabbits and Rodents,14.10
__export__.product_product_18095_fff412a6,4018761180639,Bunny Nature Vitamin Pack Vegetable Mix 50g,1.99
__export__.product_product_20506_b498047e,5703188249661,"Buster IncrediBowl, Dark Grey",10.48
__export__.product_product_18138_0187da0b,066380001327,Carefresh Confetti Colored Premium Pet 6 Ltr,5.80
__export__.product_product_18139_7a4fad56,066380000900,Carefresh Soft Pet Bedding Pink 6 Ltr,5.80
__export__.product_product_18140_cd9f9c7c,066380000887,Carefresh Ultra Premium Pet Bedding  6ltr,5.80
__export__.product_product_50421_f6d2be4a,022517437476,Catit Flower Fountain with LED Night light 3L,23.17
__export__.product_product_18475_f5c14254,022517507254,Catit Design Senses Scratch Pad,17.26
__export__.product_product_41240_0c50398f,4002973264867,Cat's Best Natural Gold Litter Scooper,3.10
__export__.product_product_52912_917511c9,4002973202135,Cat’s Best Smart Pellets Soft Clumping & Non-Stick,4.82
__export__.product_product_41237_7f502267,4002973201169,Cat’s Best Original Clumping & Encapsulating 4.3 Kg,4.57
__export__.product_product_52907_985237ef,4002973246870,Cat’s Best Original Clumping & Encapsulating,15.42
__export__.product_product_52903_a335524a,4002973000861,Cat’s Best Original Clumping & Encapsulating,2.95
__export__.product_product_52905_34a6fb8b,4002973191163,Cat’s Best Original Clumping & Encapsulating,5.55
__export__.product_product_52906_ee9218d8,4002973189351,Cat’s Best Original Clumping & Encapsulating,11.55
__export__.product_product_52913_c8cf6fcb,4002973202142,Cat’s Best Smart Pellets Soft Clumping & Non-Stick,6.95
__export__.product_product_52895_b6acab55,4002973000465,Cat’s Best Universal Non-Clumping,6.90
__export__.product_product_52896_22475df1,4002973000847,Cat’s Best Universal Non-Clumping,9.60
__export__.product_product_41239_c4c814e5,4002973233535,Chipsi Climate Floor Small Animal Bedding 50X115 CM/XL,7.73
__export__.product_product_18661_69e640c7,4002973203125,Chipsi Pet Bedding Strawberry 3.2 kg,5.55
__export__.product_product_18666_8ea180ee,4002973000731,Chipsi Ultra Pet Bedding 10L,6.92
__export__.product_product_18682_9f13febb,660048061007,Chuckit Fetcher M,10.48
__export__.product_product_18725_e7f81e8a,721343521112,Clear Quest Bone-shaped waste bag holder,1.25
__export__.product_product_18756_6e1c3303,721343936619,Clear Quest Dual End Brush,1.85
__export__.product_product_56859_175ba393,074198615261,Diamond Naturals Indoor Cat Formula 3kg,8.20
__export__.product_product_56858_667f1f8f,074198615308,Diamond Naturals Kitten Formula 3kg,8.40
__export__.product_product_56231_136d2511,074198615230,Diamond Naturals Finicky Cat Formula,2.90
__export__.product_product_56857_c5d3d614,074198615223,Diamond Naturals Finicky Cat Formula,8.20
__export__.product_product_56862_53e09ba5,074198615612,Diamond Naturals Skin and Coat For All Life Stage Dog,34.30
__export__.product_product_56861_fa524562,074198615636,Diamond Naturals Skin and Coat For All Life Stage Dog,6.40
__export__.product_product_50404_d2b2bf75,6921499711298,Dog Fest Farm Fresh Meat Sticks Beef 45g,1.50
__export__.product_product_50385_10718534,6921499711540,Dog Fest Farm Fresh Beef Slices 55g For Small Breeds,1.50
__export__.product_product_50390_4db7dccc,6921499711526,Dog Fest Farm Fresh Duck Meat Bones  55g For Small Breeds,1.50
__export__.product_product_50387_a40ed96d,6921499711861,Dog Fest Farm Fresh Calcium Bones with Chicken 55g For Small Breeds,1.50
__export__.product_product_50381_55b0fa38,6921499711786,Dog Fest Farm Fresh Calcium Bones with Duck For Puppies 90g,2.80
__export__.product_product_50394_b4009244,6921499711168,Dog Fest Farm Fresh Chichen Fillet on Chewy Stick 90g,2.80
__export__.product_product_50388_cd91a675,6921499711502,Dog Fest Farm Fresh Chichen Fillet Strips 55g For Small Breeds,1.50
__export__.product_product_50398_9d2073d1,6921499711199,Dog Fest Farm Fresh Chicken Strips on Chewy Stick 90g,2.80
__export__.product_product_50396_fe977131,6921499711205,Dog Fest Farm Fresh Chicken Tenders 90g,2.80
__export__.product_product_50397_b5f57e66,6921499711793,Dog Fest Farm Fresh Duck Fillet on Chewy Stick 90g,2.80
__export__.product_product_50383_abe446a7,6921499711809,Dog Fest Farm Fresh Duck Fillet Strips 55g For Small Breeds,1.50
__export__.product_product_50406_90aa531a,6921499711557,Dog Fest Farm Fresh Meat Sticks Duck 45g,1.50
__export__.product_product_50384_ba4103ab,6921499711533,Dog Fest Farm Fresh Duck Tenders 55g For Small Breeds,1.50
__export__.product_product_50400_c2299f49,6921499712073,Dog Fest Farm Fresh Chicken Fillet Bars 90g,2.80
__export__.product_product_50399_17f3ef7e,6921499711229,Dog Fest Farm Fresh Duck Fillets 90g,2.80
__export__.product_product_50409_2a7f3083,6921959208962,Dog Fest Farm Fresh Meat Sticks with Ostrich 45g,1.50
__export__.product_product_50402_7259b3ac,6921959208979,Dog Fest Farm Fresh Medallions with Ostrich 90g,2.80
__export__.product_product_50401_2a99ece2,6921959208931,Dog Fest Farm Fresh Turkey Slices 90g,2.80
__export__.product_product_50405_367046b6,6921499711281,Dog Fest Farm Fresh Meat Sticks Lamb 45g,1.50
__export__.product_product_50386_829fe785,6921499711519,Dog Fest Farm Fresh Lamb Medallions 55g For Small Breeds,1.50
__export__.product_product_50382_91d2847f,6921499710307,Dog Fest Farm Fresh Lamb Slices For Puppies 90g,2.80
__export__.product_product_50395_20ddcded,6921499711847,Dog Fest Farm Fresh Rabbit Ear with Duck 90g,2.80
__export__.product_product_50380_9aed5666,6921499711830,Dog Fest Farm Fresh Rabbit Ears with Chicken For Puppies 90g,2.80
__export__.product_product_50389_097d17d3,6921499711854,Dog Fest Farm Fresh Rabbit Ears with Lamb 55g For Small Breeds,1.50
__export__.product_product_50393_74bd2232,6921959208986,Dog Fest Farm Fresh Slices with Goose 55g For Small Breeds,1.50
__export__.product_product_50403_9eff1171,6921959208948,Dog Fest Farm Fresh Slices with Venison 90g,2.80
__export__.product_product_56140_cbb90d80,6921499711915,Dog Fest Farm Fresh Training Treat Quail & Chia Seeds 90g,2.80
__export__.product_product_56141_2726c14e,6921499711908,Dog Fest Farm Fresh Training Treat Rabbit & Pumpkin Seeds 90g,2.80
__export__.product_product_56139_5b19b9b6,6921499711922,Dog Fest Farm Fresh Training Treat Turkey and Flax Seeds 90g,2.80
__export__.product_product_56142_1b3cfca9,6921499711939,Dog Fest Farm Fresh Training Treat Veal & Sesame Seeds 90g,2.80
__export__.product_product_50391_c9592233,6921959208917,Dog Fest Farm Fresh Turkey Meat Bones 55g For Small Breeds,1.50
__export__.product_product_50392_e98e01d7,6921959208924,Dog Fest Farm Fresh Turkey Medallions 55g For Small Breeds,1.50
__export__.product_product_18966_9d5f2dbf,6949111730540,Dogness Anti Shock Elastick Leash S 2cmx25cm Black,8.14
__export__.product_product_54696_5aecf850,6949111730663,Dogness Anti Shock Elastick Leash Blue,10.30
__export__.product_product_18992_3c641470,843775107983,Dogness Smart Cam Feeder 47.5X28.6X51CM Blue Orange,92.40
__export__.product_product_18956_de061c9a,843775107365,Dognes Bluetooth Speaker Orange,35.13
__export__.product_product_43961_9c6be457,843775113908,Dogness Car Safety Belt Long - Black/Red Striped 20X62Cm,6.56
__export__.product_product_43960_da333ae9,843775113885,Dogness Car Safety Belt Short - Black 25X21cm,4.37
__export__.product_product_44038_15fd9674,843775114240,Dogness Cat Collar - Black Floral and Black Red strips,4.04
__export__.product_product_44032_d8f90542,843775114196,Dogness Cat Collar - Camouflage Brown  and Brown Dots 2pk,4.04
__export__.product_product_44040_99c4c4c2,843775114257,Dogness Cat Collar - Grey Floral and Grey stripes,4.04
__export__.product_product_44037_dfc0d8d3,843775114233,Dogness Cat Collar - Pink letter and  Green stripes,4.04
__export__.product_product_44039_13b2179a,843775114264,Dogness Cat Collar - Purple Flower and Purple dots 2pk,4.04
__export__.product_product_44046_3e5b123c,843775114349,Dogness Cat Collar - Reflective Blue Trangle and Orange Fish 2pk,4.04
__export__.product_product_44042_404e5631,843775114332,Dogness Cat Collar - Reflective Red Triangle and Black fish,4.04
__export__.product_product_54295_d10bc863,843775113267,Dogness Challenger Herringbone Webbing Collar Purple,4.37
__export__.product_product_54302_45ab82a1,843775113298,Dogness Challenger Herringbone Webbing Harness Black,7.68
__export__.product_product_54303_f59a354b,843775113304,Dogness Challenger Herringbone Webbing Harness Black,9.75
__export__.product_product_54300_e6d6bbe6,843775113274,Dogness Challenger Herringbone Webbing Harness Black,5.44
__export__.product_product_54305_ec4b9db0,843775113410,Dogness Challenger Herringbone Webbing Harness Purple,7.62
__export__.product_product_54304_b2505a78,843775113403,Dogness Challenger Herringbone Webbing Harness Purple,6.56
__export__.product_product_54306_779c0e68,843775113427,Dogness Challenger Herringbone Webbing Harness Purple,9.75
__export__.product_product_54312_642ee986,843775113458,Dogness Challenger Herringbone Webbing Leash Black,7.73
__export__.product_product_54309_76266d42,843775113540,Dogness Challenger Herringbone Webbing Leash Purple,7.17
