id,Product/Barcode,Product Name,Price
__export__.product_product_55003_8b01ea95,635934612373,Pets.Love.Earth Mesh Sports Fabric Netherlands,8.02
__export__.product_product_55013_1496b001,6083184563510,Pets.Love.Earth Mesh Sports Fabric Portugal,8.02
__export__.product_product_55033_2ecb62ff,6083184563817,Pets.Love.Earth Mesh Sports Fabric Spain,8.02
__export__.product_product_54806_79a97e70,6083184563329,Pets.Love.Earth Mesh Sports Fabric Argentina,8.02
__export__.product_product_54816_c65e4930,6083184563725,Pets.Love.Earth Mesh Sports Fabric Brazil,8.02
__export__.product_product_55161_8c72bef8,6083174377547,Pets.Love.Earth Mesh Sports Fabric England,11.71
__export__.product_product_54826_2d206ddf,6083184563923,Pets.Love.Earth Mesh Sports Fabric France,8.02
__export__.product_product_54836_ff8f31b3,6083184563220,Pets.Love.Earth Mesh Sports Fabric Germany,8.02
__export__.product_product_54846_63b65fcc,635934612281,Pets.Love.Earth Mesh Sports Fabric Italia,8.02
__export__.product_product_55004_c0b68942,635934612380,Pets.Love.Earth Mesh Sports Fabric Netherlands,8.02
__export__.product_product_55014_ad4eef8a,6083184563527,Pets.Love.Earth Mesh Sports Fabric Portugal,8.02
__export__.product_product_55034_3e3548ef,6083184563824,Pets.Love.Earth Mesh Sports Fabric Spain,8.02
__export__.product_product_54807_961c075a,6083184563336,Pets.Love.Earth Mesh Sports Fabric Argentina,8.02
__export__.product_product_54817_50e1ee3c,6083184563732,Pets.Love.Earth Mesh Sports Fabric Brazil,8.02
__export__.product_product_55162_d1caa967,6083174377554,Pets.Love.Earth Mesh Sports Fabric England,11.71
__export__.product_product_54827_cf91da17,6083184563930,Pets.Love.Earth Mesh Sports Fabric France,8.02
__export__.product_product_54837_68db458a,6083184563237,Pets.Love.Earth Mesh Sports Fabric Germany,8.02
__export__.product_product_54847_c1785dbf,635934612298,Pets.Love.Earth Mesh Sports Fabric Italia,8.02
__export__.product_product_55005_6d5300f8,635934612397,Pets.Love.Earth Mesh Sports Fabric Netherlands,8.02
__export__.product_product_55015_2265dea7,6083184563534,Pets.Love.Earth Mesh Sports Fabric Portugal,8.02
__export__.product_product_55035_3e9e3279,6083184563831,Pets.Love.Earth Mesh Sports Fabric Spain,8.02
__export__.product_product_54774_9e5d3fac,6084001390524,Pets.Love.Earth Auto Leash,14.79
__export__.product_product_54775_a2048e3f,6084001390531,Pets.Love.Earth Auto Leash,19.72
__export__.product_product_50650_bb803f8c,635934611222,Yabeibi Bowtie Blue,2.40
__export__.product_product_50649_5ac6e9d9,635934611215,Yabeibi Bowtie Gold,2.40
__export__.product_product_50648_3985d2d3,635934611208,Yabeibi Bowtie Red,2.40
__export__.product_product_50652_10e51f8c,635934611239,Yabeibi Bowtie Silver,2.40
__export__.product_product_50644_77b1d97c,635934611161,Yabeibi Butterfly & flower soft rubber collar,2.40
__export__.product_product_52978_957e86c7,8682250511325,Pets.Love.Earth Camouflage Mattress,11.54
__export__.product_product_52977_28f7e860,8682250511318,Pets.Love.Earth Camouflage Mattress,8.18
__export__.product_product_52982_d59742ed,635934611277,Pets.Love.Earth Captain Leash and Harness,6.40
__export__.product_product_52981_f0d88046,635934611260,Pets.Love.Earth Captain Leash and Harness,5.40
__export__.product_product_22518_ed6d6f45,6084001390210,Pets.Love.Earth Car Seat Protector,11.71
__export__.product_product_50587_9f6f03bb,635934610539,Pets.Love.Earth Cat Ball With Bell - 1 pc,0.30
__export__.product_product_22530_eb1e0ef9,635934607850,Pets.Love.Earth Cat Brush Set,4.33
__export__.product_product_22519_990bceb7,6084001390166,Pets.Love.Earth Cat Den 56cm,22.19
__export__.product_product_22520_4eee1b7a,635934607904,Pets.Love.Earth Cat Litter Mat-Blue,4.44
__export__.product_product_50481_d428cae5,8682250519642,Pets.Love.Earth Cat Play Tunnel Dark Blue,18.60
__export__.product_product_50479_194e99a2,8682250519628,Pets.Love.Earth Cat Play Tunnel Pink,18.60
__export__.product_product_50480_2a88c90b,8682250519635,Pets.Love.Earth Cat Play Tunnel Yellow,18.60
__export__.product_product_22524_64b81ef4,635934608000,Pets.Love.Earth Cat Snuggle Toy,3.59
__export__.product_product_50581_e614d4a6,635934610508,Pets.Love.Earth Golf Ball with Feather Cat Toy,0.25
__export__.product_product_50601_e83a02fc,635934610751,Pets.Love.Earth Teaser Toy with Tail - Assorted,1.90
__export__.product_product_50599_29278ac1,635934610737,Pets.Love.Earth Glitter PomPom Wand with Bell,1.90
__export__.product_product_50602_40b04665,635934610720,Pets.Love.Earth Teaser Wand with Tail - Assorted,1.80
__export__.product_product_50600_a29d3b16,635934610744,"Pets.Love.Earth Cat Wand with Pompon , Tassel and Bell",2.90
__export__.product_product_50580_5b990744,635934610676,Pets.Love.Earth Colorful Feather Wand with Bell,0.50
__export__.product_product_50577_26788480,635934610553,Pets.Love.Earth  Tumbler Mouse Cat Toy,0.50
__export__.product_product_50582_fc37c9fd,635934610706,Pets.Love.Earth Cat Interactive Stick with Fish,0.60
__export__.product_product_22531_d2fded8b,635934607935,Pets.Love.Earth Chain Dog Leash -Red,4.82
__export__.product_product_44093_d45ad692,635934609823,"Pets.Love.Earth Chewing bone with bull pizzle filling, 15 cm, 90 g",1.85
__export__.product_product_44101_a2f8e58c,635934609748,"Pets.Love.Earth Chewing bone with tripe filling, 12 cm, 2 pcs./60 g",4.43
__export__.product_product_44095_5b982497,635934609724,"Pets.Love.Earth Chewing bone with tripe filling, 12 cm, 2 pcs./60 g",2.75
__export__.product_product_44096_420b087d,635934609830,"Pets.Love.Earth Chewing bone with tripe filling, 15 cm, 90 g",1.80
__export__.product_product_50200_0c761af3,635934609359,"Pets.Love.Earth Chewing bone with tripe filling, 17 cm, 115 g",2.90
__export__.product_product_44104_6aac2b3d,635934609373,"Pets.Love.Earth Chewing bone with tripe filling, 21 cm, 170 g",4.09
__export__.product_product_44100_e8520d52,635934609793,"Pets.Love.Earth Chewing bone with tripe filling, 22 cm, 230 g",7.73
__export__.product_product_50201_3a1fb2b6,635934609366,"Pets.Love.Earth Chewing bone with vitamin filling, 12 cm, 70 g",2.90
__export__.product_product_44098_0b52fb07,635934609328,"Pets.Love.Earth Chewing bones with lamb, 10 cm, 2 pcs./40 g",4.04
__export__.product_product_44092_05439aa6,635934609717,"Pets.Love.Earth Chewing rings, 7 cm, 2 pcs./ 60 g",2.19
__export__.product_product_50199_9f7c3f4d,635934609342,"Pets.Love.Earth Chewing rolls, pressed, 25 cm/ 20 mm, 2 pcs./80 g",2.90
__export__.product_product_50197_a887fd82,635934609298,"Pets.Love.Earth Chewing shoe, large, 20 cm, 45 g",3.50
__export__.product_product_44090_cdb746ed,635934609816,"Pets.Love.Earth Chewing shoes, small, 12 cm, 2 pcs./18 g",1.46
__export__.product_product_50742_dab6d0ba,635934611246,Yabeibi  Pet Collar Bell (1 pc),1.00
__export__.product_product_52936_6790f827,635934610522,Pets.Love.Earth colorful bell rubber ball,0.60
__export__.product_product_52935_55af3dca,635934610515,Pets.Love.Earth colorful bell rubber ball,0.50
__export__.product_product_50645_625cfccb,635934611178,Yabeibi Colorful Hand Knitting Cat/Small Dog Collar,2.40
__export__.product_product_50598_135038cb,635934610690,Pets.Love.Earth Flexible Feather Wand with Suction Cup,1.50
__export__.product_product_50597_37d91e36,635934610683,Pets.Love.Earth Teaser With Bright Colorful Tinsels,1.50
__export__.product_product_50647_870ce0a3,635934611192,Yabeibi Colorful Hand Knitting Stripe Cat/Small Dog Collar,2.40
__export__.product_product_54356_9b4b19fe,8682250513190,Pets.Love.Earth Cookie Series Turquoise,6.10
__export__.product_product_54355_54fad6ce,8682250511462,Pets.Love.Earth Cookie Series Rose Pink,12.90
__export__.product_product_50575_bdd9c425,635934610478,Pets.Love.Earth Corrugated Cat House,9.90
__export__.product_product_50163_1676ec20,635934609496,"Pets.Love.Earth Denta Fun Beef Chewing Braids, 12 cm, 2 pcs./110 g",2.50
__export__.product_product_44085_2b3aed8d,635934609694,"Pets.Love.Earth Denta fun knotted chewing bone, natural, 11cm, 50g",1.46
__export__.product_product_44084_765aa7cf,635934609786,"Pets.Love.Earth Denta fun knotted chewing bone, natural, 16 cm, 110 g",2.18
__export__.product_product_50176_f1176049,635934609588,"Pets.Love.Earth Denta Fun Knotted Chicken Chewing Bone, 15 cm, 70 g",1.90
__export__.product_product_50164_0afe32fe,635934609502,"Pets.Love.Earth Denta fun knotted spirulina chewing bone, 11 cm, 50 g",0.90
__export__.product_product_50169_c85a6948,635934609557,"Pets.Love.Earth Denta fun spirulina chewing chips, 100 g",1.50
__export__.product_product_50696_21a2ad57,635934611147,Yabeibi Diamonds Dog/Cat Collar,6.40
__export__.product_product_22688_00ddfa90,635934607867,Pets.Love.Earth Dog and Puppy Pads Original 12PK(60x60cm),3.59
__export__.product_product_22536_3121fbb4,635934607973,Pets.Love.Earth Dog And Puppy Dental Care Kit,4.82
__export__.product_product_22542_dd513bdf,635934607928,Pets.Love.Earth Dog Rope Lead,6.04
__export__.product_product_22545_a4950e9f,635934607843,Pets.Love.Earth Dogs Brush Set of 2,4.33
__export__.product_product_55543_e9343495,8682250512483,Pets.Love.Earth Dondurma Series Blue,23.26
__export__.product_product_55542_e021d7a9,8682250512476,Pets.Love.Earth Dondurma Series Blue,15.82
__export__.product_product_55541_037eb47c,8682250512469,Pets.Love.Earth Dondurma Series Blue,13.02
__export__.product_product_55626_1c879042,8682250512384,Pets.Love.Earth Dondurma Series Grey/Red,13.02
__export__.product_product_55544_9d7bcbcb,8682250512490,Pets.Love.Earth Dondurma Series Blue,27.90
__export__.product_product_55629_5bad6803,8682250512414,Pets.Love.Earth Dondurma Series Grey/Red,27.90
__export__.product_product_50426_85d09280,8682250511547,Pets.Love.Earth Donut Series Large Burgundy-Anthracite Grey,92.30
__export__.product_product_50425_a6a065ec,8682250511523,Pets.Love.Earth Donut Series Large Camel Brown,92.30
__export__.product_product_53249_e074849e,6084001390098,Pets.Love.Earth Eco Bamboo Pet Bowls,4.93
__export__.product_product_53248_1d2c4036,6084001390104,Pets.Love.Earth Eco Bamboo Pet Bowls,4.33
__export__.product_product_50596_170322f3,635934610669,Pets.Love.Earth  PomPom Wand with Colored Feathers,1.50
__export__.product_product_50646_53d06944,635934611185,Yabeibi Flower cat collar,2.40
__export__.product_product_50569_cb59445d,635934610430,Pets.Love.Earth Flower Cat Toy with Butterfly,1.90
__export__.product_product_54445_c10ec463,8682250519437,Pets.Love.Earth Foam Bed - Yellow,5.90
__export__.product_product_54443_8b97c0d7,8682250519413,Pets.Love.Earth Foam Bed - Yellow,3.90
__export__.product_product_55228_77bfb5dc,635934608963,Pets.Love.Earth Heavy Duty Dog Collar,10.48
__export__.product_product_55227_1200c5e6,635934608956,Pets.Love.Earth Heavy Duty Dog Collar,9.86
__export__.product_product_55226_837551b1,635934608918,Pets.Love.Earth Heavy Duty Dog Collar,8.63
__export__.product_product_22450_f6ae3c5f,635934608949,Pets.Love.Earth  Heavy Duty Dog Collar Red/PinkBlue/Green -S,9.26
__export__.product_product_55230_7bca03f0,635934608987,Pets.Love.Earth Heavy Duty Dog Harness,10.48
__export__.product_product_55232_bfd2571a,635934609014,Pets.Love.Earth Heavy Duty Dog Harness,11.71
__export__.product_product_55231_5a74c56b,635934609007,Pets.Love.Earth Heavy Duty Dog Harness,11.10
__export__.product_product_55229_cb07ad62,635934608970,Pets.Love.Earth Heavy Duty Dog Harness,9.86
__export__.product_product_55234_9b571cf7,635934609045,Pets.Love.Earth Heavy Duty Dog Leash,10.48
__export__.product_product_50684_06b11f77,635934609311,Pets.Love.Earth Infrared Laser Cat Toy,4.30
__export__.product_product_50643_6f76e0c3,635934611154,Yabeibi Japanese soft Rubber collar,2.40
__export__.product_product_50152_f43469e9,635934609403,Pets.Love.Earth kau knochen 140g,1.50
__export__.product_product_50591_6e86bcec,635934610607,Pets.Love.Earth Large crucian carp Cat Toy,1.50
__export__.product_product_50572_4b0b7822,635934610652,Pets.Love.Earth Linen cat hammock,3.50
__export__.product_product_50697_5b7b2a1f,635934609908,Pets.Love.Earth Lint Roller Refills - 2 pack,1.90
__export__.product_product_50713_61138273,635934610317,Pets.Love.Earth Lint Roller 50 Sheets,1.90
__export__.product_product_22571_a621355e,635934607874,Pets.Love.Earth Litter Scooper (Red),1.49
__export__.product_product_54657_8aac14ca,6084001390258,Pets.Love.Earth Luxury Dog Collar,4.93
__export__.product_product_54656_16b1ea03,6084001390241,Pets.Love.Earth Luxury Dog Collar,4.33
__export__.product_product_54655_68f6c136,6084001390234,Pets.Love.Earth Luxury Dog Collar,3.70
__export__.product_product_22598_47a40aaa,6084001390265,Pets.Love.Earth Luxury Dog Lead Brown,4.93
__export__.product_product_53911_2de7b253,8682250510755,Pets.Love.Earth Makaron series Grey Dot Design,32.10
__export__.product_product_53910_8265e8bb,8682250510748,Pets.Love.Earth Makaron series Grey Dot Design,22.32
__export__.product_product_53909_d4cef0a5,8682250510731,Pets.Love.Earth Makaron series Grey Dot Design,18.15
__export__.product_product_53912_da17dd6e,8682250510762,Pets.Love.Earth Makaron series Grey Dot Design,37.68
__export__.product_product_53914_96d96723,8682250512926,Pets.Love.Earth Makaron Series Palm,22.32
__export__.product_product_53913_b19eaee4,8682250512919,Pets.Love.Earth Makaron Series Palm,18.15
__export__.product_product_53916_bb297439,8682250512940,Pets.Love.Earth Makaron Series Palm,37.68
__export__.product_product_50589_f8b2f185,635934610584,Pets.Love.Earth Medium crucian carp Cat Toy,1.50
__export__.product_product_50455_233b3bd2,8682250511592,Pets.Love.Earth Mini Cave Medium Zebra Design,17.68
__export__.product_product_50503_1829e2d5,8682250512575,Pets.Love.Earth Mini Tent Black and White,12.90
__export__.product_product_50453_1df0173d,8682250511264,Pets.Love.Earth Mini Tent Blue and White,12.90
__export__.product_product_22629_c6eae0aa,635934608093,Pets.Love.Earth Munchy Sticks 12Pk 5 inch,2.24
__export__.product_product_50566_3ee1a5d9,635934609861,Pets.Love.Earth Nail Clipper for Cats and Small Dogs,3.59
__export__.product_product_22631_2bbfda8e,635934608161,Pets.Love.Earth Nail Clipper For Dogs,3.59
__export__.product_product_50565_24705979,635934609854,Pets.Love.Earth Nail Cutters For Medium and Large Dogs,2.90
__export__.product_product_50567_6ba839ae,635934609878,Pets.Love.Earth Nail Cutters Medium,4.80
__export__.product_product_50568_117e5d73,635934610423,Pets.Love.Earth  Nail File,0.50
__export__.product_product_55248_e609e523,635934610409,Pets.Love.Earth Normal Elizabethan Collar,8.02
__export__.product_product_55655_00bcfaa4,635934610416,Pets.Love.Earth Normal Elizabethan Collar,8.63
__export__.product_product_55249_bcbb3b43,635934610386,Pets.Love.Earth Normal Elizabethan Collar,5.55
__export__.product_product_55654_7f96bab7,635934610393,Pets.Love.Earth Normal Elizabethan Collar,6.78
__export__.product_product_55250_6cc27933,635934610379,Pets.Love.Earth Normal Elizabethan Collar,4.69
__export__.product_product_55251_c1abe4c8,635934610362,Pets.Love.Earth Normal Elizabethan Collar,4.33
__export__.product_product_55252_55f4f9a7,635934610355,Pets.Love.Earth Normal Elizabethan Collar,3.84
__export__.product_product_55253_75cd098a,635934610348,Pets.Love.Earth Normal Elizabethan Collar,3.45
__export__.product_product_55254_ca339d03,635934610331,Pets.Love.Earth Normal Elizabethan Collar,3.10
__export__.product_product_22633_7aa363d7,635934607966,Pets.Love.Earth Nursing Bottle With Cleaning Brush,4.19
__export__.product_product_53952_5c0a258f,635934610096,Pets.Love.Earth Nylon Angry bird cat Leash and Harness,6.40
__export__.product_product_53951_b6228cff,635934610089,Pets.Love.Earth Nylon Angry bird cat Leash and Harness,5.40
__export__.product_product_50691_e0c16ee4,635934610263,Pets.Love.earth Nylon angry bird safe collar,1.90
__export__.product_product_53954_4d1f0a65,635934609991,Pets.Love.Earth Nylon Army 1 cat Leash and Harness,6.40
__export__.product_product_53953_196ab2c4,635934609984,Pets.Love.Earth Nylon Army 1 cat Leash and Harness,5.40
__export__.product_product_50685_ec13ef14,635934610218,Pets.Love.Earth Nylon Army 1 safe collar,1.90
__export__.product_product_53956_4beffc15,635934610034,Pets.Love.Earth Nylon British grid cat Leash and Harness,6.40
__export__.product_product_53955_a8b35f2a,635934610027,Pets.Love.Earth Nylon British grid cat Leash and Harness,5.40
__export__.product_product_50687_5e3a74ac,635934610232,Pets.Love.earth Nylon British grid safe collar,1.90
__export__.product_product_53958_df5e2297,635934610010,Pets.Love.Earth Nylon colorful A cat Leash and Harness,6.40
__export__.product_product_53957_126ca2e2,635934610003,Pets.Love.Earth Nylon colorful A cat Leash and Harness,5.40
__export__.product_product_50686_c962776a,635934610225,Pets.Love.Earth Nylon colorful A safe collar,1.90
__export__.product_product_53960_4a5b94e7,635934609977,Pets.Love.Earth Nylon colorful stone cat Leash and Harness,6.40
__export__.product_product_53959_fabe05af,635934609960,Pets.Love.Earth Nylon colorful stone cat Leash and Harness,5.40
__export__.product_product_50683_b247a0eb,635934610201,Pets.Love.Earth Nylon colorful stone safe collar,1.90
__export__.product_product_53965_827edea5,635934609946,Pets.Love.earth Nylon Dot cat Leash and Harness,6.40
__export__.product_product_53964_498438b6,635934609939,Pets.Love.earth Nylon Dot cat Leash and Harness,5.40
__export__.product_product_50681_4f8c7a73,635934610188,Pets.Love.Earth Nylon Dot safe collar,1.90
__export__.product_product_53967_b9eaff7b,635934610119,Pets.Love.Earth Nylon flower cat Leash and Harness,6.40
__export__.product_product_53966_79f17e26,635934610102,Pets.Love.Earth Nylon flower cat Leash and Harness,5.40
__export__.product_product_50692_52b46383,635934610270,Pets.Love.Earth Nylon flower safe collar,1.90
__export__.product_product_50654_47fec780,635934609953,Pets.Love.Earth Nylon Jean fish cat leash and Harness,5.40
__export__.product_product_50682_ee3a2e1d,635934610195,Pets.Love.Earth Nylon Jean fish safe collar,1.90
__export__.product_product_53969_caa3ffbd,635934610072,Pets.Love.Earth Nylon Leopard colorful cat Leash and Harness,6.40
__export__.product_product_53968_0bdf3b05,635934610065,Pets.Love.Earth Nylon Leopard colorful cat Leash and Harness,5.40
__export__.product_product_53971_d15683ba,635934610157,Pets.Love.Earth Nylon new Jean Leash and Harness,6.90
__export__.product_product_53970_e2d79bd3,635934610140,Pets.Love.Earth Nylon new Jean Leash and Harness,5.90
__export__.product_product_50694_5e67f310,635934610294,Pets.Love.earth Nylon new jean safe collar,1.90
__export__.product_product_53973_805e5956,635934610133,Pets.Love.earth Nylon Rainbow 2 Leash and Harness,6.40
__export__.product_product_53972_7d749eba,635934610126,Pets.Love.earth Nylon Rainbow 2 Leash and Harness,5.40
__export__.product_product_50693_a2205ac3,635934610287,Pets.Love.Earth Nylon rainbow 2 safe collar,1.90
__export__.product_product_53975_45a76ed9,635934610058,Pets.Love.Earth Nylon Reflective flower cat Leash and Harness,6.40
__export__.product_product_53974_e5d1fdcb,635934610041,Pets.Love.Earth Nylon Reflective flower cat Leash and Harness,5.40
__export__.product_product_50688_8f54d1cc,635934610249,Pets.Love.Earth Nylon reflective flower safe collar,1.90
__export__.product_product_53977_9e9f7194,635934609922,Pets.Love.Earth Nylon two-color reflective cat Leash and Harness,6.40
__export__.product_product_53976_d6016aa4,635934609915,Pets.Love.Earth Nylon two-color reflective cat Leash and Harness,5.40
__export__.product_product_50695_b4efbfbf,635934610300,Pets.Love.earth Nylon two-color Reflective safe collar,1.90
__export__.product_product_50574_855a1d73,635934610461,Pets.Love.Earth Organ folding corrugated cat Scratch Board,6.50
__export__.product_product_50622_480f8bd8,635934610904,Pets.Love.Earth Pet backpack Black/Beiage/Pink L,32.16
__export__.product_product_50616_44bf66fa,635934610966,"Pets.Love.Earth Pet backpack  Blue,Pink,Green S",8.90
__export__.product_product_53995_1184bdab,635934610775,Pets.Love.Earth Pet Travel Carrier,14.12
__export__.product_product_53994_d2f86847,635934610782,Pets.Love.Earth Pet Travel Carrier,13.30
__export__.product_product_54001_e6f43d0c,635934610805,Pets.Love.Earth Pet backpack Green,15.70
__export__.product_product_54000_e50454b4,635934610812,Pets.Love.Earth Pet backpack Green,14.90
__export__.product_product_53996_8742cde1,635934610874,Pets.Love.Earth Pet Travel Carrier,13.20
__export__.product_product_50619_5d234ba4,635934611000,Pets.Love.Earth Pet backpack Mix Colour with Extra fittings,19.90
__export__.product_product_50626_ecb8650f,635934610836,Pets.Love.Earth Pet backpack Pink/Blue L,25.80
__export__.product_product_50627_1f0fe010,635934610843,Pets.Love.Earth Pet backpack Pink/Blue/Black S,24.40
__export__.product_product_50621_8d94d6c0,635934610898,Pets.Love.Earth Pet backpack Pink/Grey/Black M,19.90
__export__.product_product_50630_c6a3dce8,635934610997,Pets.Love.Earth Pet backpack Pink/Grey/Blue,18.10
__export__.product_product_50628_7c73657b,635934610973,Pets.Love.Earth Pet backpack Red/Blue L,25.90
__export__.product_product_50629_9f484a49,635934610980,Pets.Love.Earth Pet backpack Red/Blue M,24.30
__export__.product_product_50620_0a2aa1c9,635934610881,Pets.Love.Earth Pet backpack  Small Grey/Pink,16.70
__export__.product_product_50632_233ff8f3,635934611031,Pets.Love.Earth Pet backpack  Transparent and Black,32.90
__export__.product_product_50631_5076b0d5,635934611086,"Pets.Love.Earth Pet backpack  Transparent and Black,Silver,Blue,Grey",54.00
__export__.product_product_50618_4d0deb51,635934611079,Pets.Love.Earth Pet backpack Transparent and Blue,24.80
__export__.product_product_50639_83c950a0,635934611048,Pets.Love.Earth Pet backpack Transparent and Green,24.70
__export__.product_product_50633_68e3eb5d,635934611093,Pets.Love.Earth Pet backpack Transparent and Mix Colour,29.40
__export__.product_product_50634_4d48a43b,635934611109,Pets.Love.Earth Pet backpack Transparent and Mix Colour,29.40
__export__.product_product_50617_1ee16170,635934611062,Pets.Love.Earth Pet backpack Transparent and Pink,24.80
__export__.product_product_50638_15876d08,635934611024,Pets.Love.Earth Pet backpack  Transparent and Red,33.80
__export__.product_product_50637_56962702,635934611017,Pets.Love.Earth Pet backpack  Transparent and Silver,33.80
__export__.product_product_50724_a071f40e,635934611055,Pets.Love.Earth Pet backpack Transparent and Yellow,24.70
__export__.product_product_50636_7a601684,635934610928,Pets.Love.Earth Pet backpack Transparent L,33.80
__export__.product_product_50635_bfe8c29f,635934610911,Pets.Love.Earth Pet backpack Transparent S,29.40
__export__.product_product_50615_72215016,635934610959,"Pets.Love.Earth Pet backpack Transparent with Blue,Red,Black S",16.60
__export__.product_product_50457_ce5a1767,8682250519611,Pets.Love.Earth Plus Shoe Series Beige,16.74
__export__.product_product_50467_605a22db,8682250513862,Pets.Love.Earth Plus Soft Series Black XLarge,58.59
__export__.product_product_50463_44750e19,8682250513701,Pets.Love.Earth Plus Soft Series Burgundy XLarge,58.59
__export__.product_product_50461_70516cce,8682250519192,Pets.Love.Earth Plus Soft Series Dark Blue XLarge,58.59
__export__.product_product_50462_3fc4a0ab,8682250519239,Pets.Love.Earth Plus Soft Series Dark Green XLarge,58.59
__export__.product_product_50465_0d43470d,8682250513763,Pets.Love.Earth Plus Soft Series Light Grey Medium,25.11
__export__.product_product_50459_3594d829,8682250519109,Pets.Love.Earth Plus Soft Series Pink Large,41.01
__export__.product_product_50458_3c8c2277,8682250519086,Pets.Love.Earth Plus Soft Series Pink Small,17.85
__export__.product_product_50466_9f5ea417,8682250513817,Pets.Love.Earth Plus Soft Series Rose Pink Large,41.01
__export__.product_product_50464_77a149da,8682250513718,Pets.Love.Earth Plus Soft Series Turquoise Small,17.85
__export__.product_product_50579_1e8da308,635934610560,Pets.Love.Earth Plush mouse,0.30
__export__.product_product_50588_45fc540e,635934610577,Pets.Love.Earth Plush Mouse in Cage,0.60
__export__.product_product_54398_ce152ca9,8682250517907,Pets.Love.Earth Ponchik Circle Bed White,18.15
__export__.product_product_50504_7af4a7a1,8683604130292,Pets.Love.Earth Ponchik Plus Soft Series Circle Green XLarge,25.82
__export__.product_product_54403_b79f3327,8683604131145,Pets.Love.Earth Ponchik Plus Soft Series - Green,54.42
__export__.product_product_54402_b5cb34b6,8683604131138,Pets.Love.Earth Ponchik Plus Soft Series - Green,37.11
__export__.product_product_54401_43979d73,8683604131121,Pets.Love.Earth Ponchik Plus Soft Series - Green,24.84
__export__.product_product_54778_4bc8ef4f,8683604131183,Pets.Love.Earth Ponchik Plus Soft Series - Pink,54.42
__export__.product_product_54777_0b9a90b7,8683604131176,Pets.Love.Earth Ponchik Plus Soft Series - Pink,37.11
__export__.product_product_54776_2670c500,8683604131169,Pets.Love.Earth Ponchik Plus Soft Series - Pink,24.84
__export__.product_product_50474_996f0079,8683604131152,Pets.Love.Earth Ponchik Plus Soft Series XLarge Green,79.80
__export__.product_product_54779_1c1f68cc,8683604131190,Pets.Love.Earth Ponchik Plus Soft Series - Pink,79.80
__export__.product_product_54112_4aea7838,6084001390616,Pets.Love.Earth QR Crystal Cat Collar,7.41
__export__.product_product_54113_59e7a697,6084001390623,Pets.Love.Earth QR Crystal Cat Collar,7.41
__export__.product_product_54114_a6f7edc7,6084001390609,Pets.Love.Earth QR Crystal Cat Collar,7.41
__export__.product_product_22642_5b6eed87,6084001390548,Pets.Love.Earth QR Glitter Cat Collar Blue,4.33
__export__.product_product_22643_857b0a4e,6084001390562,Pets.Love.Earth QR Glitter Cat Collar Fuchsia,4.33
__export__.product_product_22644_b343d208,6084001390555,Pets.Love.Earth QR Glitter Cat Collar Silver,4.33
